{
  "apiVersion": "opentestfactory.org/v1alpha1",
  "kind": "ExecutionResult",
  "metadata": {
    "name": "Generated Job",
    "workflow_id":"123456789",
    "job_id": "job_id",
    "step_id": "step_id",
    "step_origin": [
        "000",
        "001",
        "002"
    ],
    "step_origin_status": {
        "000": 1,
        "001": 1,
        "002": 1
     },
    "step_sequence_id": 123456,
    "attachments": {
        "log.html": {"uuid": "111-222-333"},
        "src/test/resources/passing-output.xml": {"uuid": "444-555-666"},
        "report.html": {"uuid": "777-888-999"}
    },
    "is_last_step": true
  },
  "attachments": [
        "log.html",
        "src/test/resources/passing-output.xml",
        "report.html"
  ]
}
